text	label
i need to switch to a new insurance plan	insurance_change
how long should i fry an egg for	cook_time
what is my annual percentage rate	interest_rate
please put babysitting on my to do list	todo_list_update
roll the five sided die	roll_dice
how many calories are in a bag of regular doritos	calories
to vacation to tel aviv do i need a travel visa	international_visa
can you get me any recommendations for the place i'm traveling to	travel_suggestion
book an oil change please	schedule_maintenance
on tuesday you are supposed to have a meeting	calendar
do i have any remaining pto days	pto_balance
is my phone somewhere around here	find_phone
let me know when it's been 5 minutes	timer
does mexico require an international visa	international_visa
what percentage of gas do i have left	gas
how expensive is it to fuel this car	mpg
check me out on the map	current_location
for friday, add a doctor's appointment to my calendar	calendar_update
i need buy a birthday gift for sue taken off my calendar  it is on monday or tuesday last week	calendar_update
please tell me the reason for the hold on my bb&t account	account_blocked
can you give me instructions on how to make alfredo	recipe
what in the world is my credit rating	credit_score
bring the sound up	change_volume
how many weeks of vacation time do i have	pto_balance
tell me the gas mileage on my car	mpg
is it safe for people to travel to pakistan	travel_alert
you are wrong	no
please increase the speed of your speech, it is too slow	change_speed
rolls have how many calories	calories
how can i take a bus to dallas	directions
what's a good italian meal	meal_suggestion
what is the name of the person who made you	who_made_you
i dropped my card in my gasoline and the printing wore off	damaged_card
can i use sour cream instead of yogurt	ingredient_substitution
activate my furnace please	smart_home
i want directions to phoenix	directions
clear my entire schedule for april 1	calendar_update
the place you were born is	where_are_you_from
my card's magnetic strip is not working and i want to notify them	damaged_card
add this song to my jazz playlist	update_playlist
is butter a substitute for oil	ingredient_substitution
do i have anything on my calendar next sunday	calendar
please tell my bank i'll be in anchorage this week	travel_notification
add everything to my shopping cart	order
what will my state taxes amount to this year	taxes
can you find me a recipe for quiche	recipe
what is the time right now in the peruvian time zone	time
how long do i cook chicken breast	cook_time
how do you report a burned debit card	damaged_card
what do i have planned on my calendar for next sunday	calendar
i need anniversary dinner added to my schedule for march 7	calendar_update
let me know some things to do in phoenix	travel_suggestion
turn on the rap playlist	play_music
what does it take to get a new card	new_card
i want that volume bumped up to 4	change_volume
tell me how to improve my credit score	improve_credit_score
maybe we can go to the next song	next_song
what is the available balance in savings	balance
how long does it take to make pho	cook_time
how to tell the company that my credit card melted	damaged_card
what you age on your last birthday	how_old_are_you
put clean refrigerator on my spring cleaning to do list	todo_list_update
why am i seeing a hold on my boa account	account_blocked
tell me your full name	what_is_your_name
what is the wait time at this restaurant	how_busy
would you tell me when i should replace my tires next if i last replaced them on june 2	tire_change
would i need to buy a plug converter when in rome	plug_type
find a suitable lodging in vancouver on march 16-19	book_hotel
i need to book a roundtrip flight from dallas to los angeles from march 2 to march 10	book_flight
when can i expect to receive the order	order_status
help me get my gas bill paid	pay_bill
call aj now	make_call
how do i know if it is time to replace my tires	tire_change
what is the calorie content of a scoop of chocolate ice cream	calories
please run that by me again	repeat
pull up my shower playlist	play_music
what is life's purpose	meaning_of_life
i lost my card, how should i report that	report_lost_card
what information can you give me on the meaning of life	meaning_of_life
ac temperature is at what	smart_home
what ingredients are in cheese cake	ingredients_list
is it possible for you to read the things on my shopping list	shopping_list
when do i need to pay my car insurance bill by	bill_due
do you know any jokes	tell_joke
should i take a different route to work	traffic
find me a flight from ft lauderdale to houston on southwest	book_flight
will it be okay for me to eat my leftover turkey from monday that's been in my fridge	food_last
when can i expect meal of salmon to be finished	cook_time
does the bus go to the washington monument	directions
what did i spend at the grocery store yesterday	spending_history
when was the last date that i was paid	payday
can i increase the credit limit on my discover card	credit_limit_change
i wanna know your hobbies	what_are_your_hobbies
is almond milk an acceptable substitute for milk	ingredient_substitution
how do you cook apple pie	recipe
tell me something interesting about lake tahoe	fun_fact
i would like to know delta's carry on policy	carry_on
what name do you want me to use	what_is_your_name
tell me if you like cats or dogs	do_you_have_pets
who are the people responsible for you	who_made_you
how much paid time off have i earned to date	pto_balance
hi, i'm john	change_user_name
please tell me where to get the w2	w2
is my apr rate better than most	apr
i must call jordan	make_call
help! i'm a victim of credit card fraud!	report_fraud
tell me when you were born	how_old_are_you
what is the minimum amount due on my cable bill	min_payment
inform me as to how much gas my car has	gas
i want to pay my bill	pay_bill
when will lettuce in the fridge go bad	food_last
did i put unpacking groceries on my to do list	todo_list
can you share some trivia with me about us history	fun_fact
what are the reviews like at minnis	restaurant_reviews
what are the steps i need to follow to make chewy rice krispies treats	recipe
check out my location up on the map	current_location
tell me when today's meeting is supposed to happen	meeting_schedule
how long ago was my car last in the shop	last_maintenance
i'd like to schedule a tire inspection	schedule_maintenance
i am needing to know how low the air in my tires are	tire_pressure
where on the cheerios box are the nutrition facts	nutrition_info
my card became damaged when i dropped it in the parking lot and it got ran over	damaged_card
what is the square root of 36	calculator
what are the details on my health care plan	insurance
submit full payment to chase for my visa bill	pay_bill
i don't want you connected to my phone anymore	sync_device
how long do i cook steak	cook_time
that is not true, it's false	no
do you mind if i ask how old you are	how_old_are_you
how do i find out my tire pressure	tire_pressure
i was using my credit card as a cutting board and accidentally sliced it in half	damaged_card
get a uber for two to go to a romantic dinner at mcdonalds	uber
what's the exchange rate between dollars and pesos	exchange_rate
how healthy is pumpkin pie	nutrition_info
speak it again slowly	change_speed
find out where my phone is	find_phone
please change credit	credit_limit_change
tell me my apr rate	apr
how were you made	who_made_you
how long can i go before i need to change my tires	tire_change
make sure bread gets added to my shopping list	shopping_list_update
march 2nd through march 18th, i'm going to need a jeep in frankfort	car_rental
i want to know my bill's minimum payment	min_payment
i want to eat mediterranean fare with at least four stars, near me	restaurant_suggestion
can you tell me what is 18 percent of $2500	calculator
how can i find the current interest rate for my account ending in 9012	interest_rate
do i have any vacation days to use	pto_balance
i want you to roll a 5 sided dice for me	roll_dice
take paper towels off of my shopping list	shopping_list_update
what does my shopping list say that i should get	shopping_list
how long do the brownies have to cook	cook_time
what is gumbo made of	ingredients_list
is my card's apr a decent rate	apr
tell me all the ways my credit score can get hurt	improve_credit_score
how long does it take for dough in the freezer to go off	food_last
please tell me how much i have spent recently	spending_history
how can i learn how to use direct deposit	direct_deposit
whats this song	what_song
may i suggest we go to the next song	next_song
can you tell me if you are a real live person	are_you_a_bot
what can i ask the ai	what_can_i_ask_you
i need to know why my card got declined	card_declined
let me know what do you call me	user_name
what time is it getting to be	time
what things can i do to increase my credit score	improve_credit_score
i need to know what this song is called	what_song
my checking account needs a new pin number	pin_change
please play the next song on this playlist	next_song
what happened to my cellphone	find_phone
i need to call sal	make_call
what is the most amount of time that is considered safe to store uncooked chicken in the fridge	food_last
tell my bank's fraud department i'm going to mexico	travel_notification
where can i get the form i need to do my taxes, please	w2
i need a delivery tracked	order_status
at what time should i be boarding my flight	flight_status
is there an update on flight dl123	flight_status
am i allowed to increase my credit limit to $1000	credit_limit_change
i'd love to hear a joke	tell_joke
when is it time for a tire change	tire_change
i need you to clear my todo list	todo_list_update
what benefits does my insurance have	insurance
i'm going to canada soon, do i need a visa	international_visa
i need you to tell me what time it is in new york now	time
do you need a special outlet converter in sweden	plug_type
cancel my reservation for dinner this saturday	cancel_reservation
what can't i carry-on to delta	carry_on
should i cook this for a long time	cook_time
tell me how long i will need to spend preparing a meat loaf dish	cook_time
how many calories are in cheerios	calories
i want to get an appointment to get my oil changed	schedule_maintenance
is it possible to get a table for 4 at the village inn around 10am	restaurant_reservation
do you have the time	time
could you tell me how much i've spent over the past two weeks	spending_history
how much gas do i have in my tank	gas
how healthy is tomato soup	nutrition_info
get reservations at olive garden for two at 7:00pm under michael	restaurant_reservation
how busy it that place for dinner	how_busy
i need laundry to be put on my list of things to do	todo_list_update
what is my name saved as in your system	user_name
how long will i have to wait at cheesecake factory	how_busy
what is the lowest amount i can pay for my cellphone bill	min_payment
do i have any meetings planned for today	meeting_schedule
what do i say when i report a split credit card	damaged_card
find my credit score and tell it to me	credit_score
madison to atlanta delta ticket	book_flight
book a flight to los angeles from las vegas on american airlines	book_flight
because of circumstances i don't need my reservation anymore	cancel_reservation
can you roll the dice	roll_dice
schedule a mechanic	schedule_maintenance
speak in german	change_language
what location were you born	where_are_you_from
show me some restaurants that have high reviews for eating out	restaurant_suggestion
can you add cherrios to my shopping list	shopping_list_update
how is the weather in austin	weather
what's the current count of my pto days	pto_balance
definition of zesty	definition
when referring to you, what name should i use	what_is_your_name
tell me when my meeting is scheduled with roger	meeting_schedule
onpay gives you two convenient ways to pay your employees	direct_deposit
is the sushi well-received at yakamoto	restaurant_reviews
set up direct deposit for me	direct_deposit
tell me what time it is	time
what items are on my list of to-dos	todo_list
what are some cool tourist attractions in england	travel_suggestion
what is the status of my credit card application looking like	application_status
can you change my credit limit	credit_limit_change
skip over this song	next_song
can you monitor my package's progress	order_status
absolutely not	no
are there any open reservations at outback tonight	restaurant_reservation
is the dollar strong against the yen today	exchange_rate
turn up the speaker volume	change_volume
i'm traveling to ca soon and want to inform my bank	travel_notification
what are you’re hobbies, ai	what_are_your_hobbies
what is my intetest rate	interest_rate
i wanna know the next holiday	next_holiday
where should i look for my w-2	w2
please change my name to tom	change_user_name
how much is the minimum payment on my chase card	min_payment
can you find me my phone	find_phone
can you schedule a meeting with matt for 3	schedule_meeting
walk me through making changes to my insurance policy	insurance_change
could you let me know how old you are	how_old_are_you
can you find my credit score	credit_score
delete my to do list	todo_list_update
you wrote what for my name	user_name
can you find me the apr listed on the statement for my citi mastercard	apr
where is my location	current_location
i have transactions on my card that aren't mine	report_fraud
look for me a table at carl's cabin for twelve at eight	restaurant_reservation
please lookup my experion credit score	credit_score
please transfer $5000 to money market from checking account	transfer
how busy is mc donald at 8 in the morning	how_busy
my account needs to be frozen	freeze_account
how did my bank account get frozen	account_blocked
i prefer to be called jason	change_user_name
add hells bells by acdc to my playlist	update_playlist
i'd like to set a new timer	timer
can i schedule a check up for my tires somewhere	schedule_maintenance
please call an uber for 6 people to go to amazon's southside warehouse	uber
that's not what i want!	no
needing you to play the next song	next_song
let me know what's on my shopping list	shopping_list
how much is 10 us dollars in canadian dollars	exchange_rate
my visa has been damaged	damaged_card
does z used the same plus as we do in the united states	plug_type
what are the best italian restaurants in chicago	restaurant_suggestion
can you please sat it one more time	repeat
can i sub sugar for salt	ingredient_substitution
i am confused because my account seems to have been blocked for no reason	account_blocked
how much are my taxes for my income	taxes
what do i pay in taxes	taxes
can you tell me what name you have for me	user_name
please tell me my bank balance	balance
the answer is false	no
what kind of sockets do the us use	plug_type
when will i know if my visa card application was approved	application_status
could you share my credit score	credit_score
what are the things that i have for today	todo_list
what is the meaning of altruism	definition
what subjects are you familiar with	what_can_i_ask_you
are your real or artificial	are_you_a_bot
i was wondering what age you are	how_old_are_you
pull up ramen recipes please	recipe
play the song called dancing on the ceiling	play_music
cumin may be substituted for tumeric	ingredient_substitution
tell my bank that i'm going to france	travel_notification
ai, how are you doing	greeting
review of my card apr	apr
can i get my w-2 online	w2
can you tell me when my flight is going to board	flight_status
please unreserve that table	cancel_reservation
remove wine and add beer to my shopping list	shopping_list_update
turn tv on please	smart_home
whats the total of my federal taxes	taxes
how do i change my pin for number for my abc bank account	pin_change
tell me the reviews for chipotle	restaurant_reviews
did i get my car inspected recently	last_maintenance
do they use weird plugs in australia where i'd need some kind of socket converter	plug_type
can i get a timer set	timer
where do you suggest i plan my next vacation	travel_suggestion
tell me the name of this song	what_song
could you let me know what song this is	what_song
restore my factory settings immediately please	reset_settings
what is the total number of days i have taken off so far	pto_used
can i move some money between my two accounts	transfer
what do you i need to make pizza dough	ingredients_list
i need to know where to get a w-2 form	w2
let me know when my credit card expire	expiration_date
i missed what you said, please say it again	repeat
can i get beer within my deposit account	balance
where are you coming from	where_are_you_from
can you multiply 45 by 23	calculator
where do i find my w-2 form	w2
where do i report that my card was lost	report_lost_card
read me the definition of ajar	definition
steps to raise my credit score	improve_credit_score
check the apr on my disney visa, please	apr
please look up my card's expiration date	expiration_date
what date does my capital one card expire	expiration_date
do you have any good ways to make tomato soup	recipe
do i need a travel visa to visit japan	international_visa
what is the calorie count for muffins	calories
tell me where you were created	where_are_you_from
help, i've lost my cellphone!	find_phone
i need you to set timer for me	timer
can you provide me my credit score	credit_score
can you turn my lights down just a bit	smart_home
can you share a humorous joke with me	tell_joke
can you add remember to register for the race on my calendar for the 15th of march	calendar_update
i'd like to you order everything that's on my shopping list	order
a meeting needs to be schedule and i need to know how	schedule_meeting
what's the interest rate on my savings account	interest_rate
how about a reminder	reminder_update
what time is it over in pacific time	time
take soda from my shopping list, and while you're at it add tea	shopping_list_update
i am going to south america, let my bank know	travel_notification
check the status of my credit card application please	application_status
what ingredients are required for chicken noodle soup	ingredients_list
is my order shown as delivered	order_status
i want to know the expiry month of my card	expiration_date
let me know the status of flight dl123	flight_status
that's wrong	no
what are the things you can help me with	what_can_i_ask_you
what is the tire pressure of the car	tire_pressure
find me a room near the jacksonville stadium between january 1st through january 3rd	book_hotel
where do you call home	where_are_you_from
how do i slow down my ai's voice	change_speed
i'd like to pay $4735 to my water bill	pay_bill
please rely on your original settings	reset_settings
how much do i owe the irs	taxes
whats the minimum payment on my electric bill	min_payment
how do i make that scottish dish with all the blood and sausage	recipe
i need you to reserve a table for 4 at red robin under the name kevin at 7	restaurant_reservation
who do i contact to report fraud on my visa	report_fraud
call my friend aj	make_call
can you tell me delta's carry on policy	carry_on
how can i rent a ride in alaska from march 5th to march 18th	car_rental
set my amex pin to 1234	pin_change
is there a way to increase the credit limit on my american express card	credit_limit_change
any suggestions for a peruvian meal	meal_suggestion
what is my current gas level at	gas
what kind of questions can i ask you	what_can_i_ask_you
i want the volume at level 4	change_volume
2 cups of grapes have how many calories	calories
can you show me the dictionary definition of ajar	definition
can you complete an application for a new credit card for me	new_card
transfer 100 dollars between checking and savings	transfer
please repeat what you just said	repeat
does the country have a travel alert	travel_alert
could you repeat what you just said again	repeat
can you find a recipe on how to make chow mein	recipe
i need you to remind me to get something done	reminder_update
speak slower	change_speed
what is the process to set up a meeting	schedule_meeting
give me directions to phoenix	directions
what number do you get when you roll one six sided die	roll_dice
will i get my paycheck soon	payday
have i got any meetings today with sara	meeting_schedule
can you tell me how you're doing today	greeting
at walmart my card got declined when i was buyng qtips	card_declined
please put dusting on my list of things to do	todo_list_update
when is my next direct deposit from my job	payday
what are the gps coordinates where i am located	current_location
what is 8 factorial	calculator
i must call roderick	make_call
go ahead and skip this song and play the next one	next_song
i gotta know when my flight will land	flight_status
i'm looking for a roundtrip flight from fwa to hsv for march first to march fifth	book_flight
do you know what my precise credit score is	credit_score
is it safe for me to visit malawi	travel_alert
what year were you born	how_old_are_you
where the bleep did i put my bleeping phone	find_phone
i am needing to know what some of your hobbies are	what_are_your_hobbies
how many miles until i change my tires	tire_change
could you list my health benefits	insurance
will you let me know my bank balance	balance
how safe is it to travel to mongolia (how safe is mongolia)	travel_alert
what is my to-do list like today	todo_list
i need to know what traffic will be like in temp	traffic
how long is it safe to leave shrimp in the fridge	food_last
look for travel alerts for china	travel_alert
heller	greeting
what is my b of a credit card's apr	apr
find the nutrition info for ketchup for me	nutrition_info
can you suggest meals from italy to me	meal_suggestion
how much are my state taxes	taxes
how much vacation have i earned	pto_balance
what's the minimum amount for my electric bill	min_payment
are there any travel alerts for ukraine	travel_alert
can you adjust the lights down	smart_home
i want to hear the next song	next_song
what kind of insurance plan am i enrolled in	insurance
are there are any good places in washington that serve cheese pizza	restaurant_suggestion
put the volume to 4	change_volume
i'm out of kleenex so will you put that on my shopping list	shopping_list_update
how to protect my credit score	improve_credit_score
tell me the time in las vegas	time
can you get access to my phone right now	sync_device
will the restaurant be busy at 5pm	how_busy
what's the total i've spent on shoes this month	spending_history
i wanna have an appointment to get my oil changed	schedule_maintenance
please change the name you refer to me by	change_user_name
do i have any meetings today between 9 and 10:15	meeting_schedule
how much did i spend on gear two weeks ago	spending_history
do you know the mpg for this vehicle	mpg
how healthy is spaghetti	nutrition_info
looks like someone made an unauthorized charge to nike on my account	report_fraud
what's your home town	where_are_you_from
please respond to me in english from now on	change_language
i tried to use my credit card yesterday, but it did not work	card_declined
is there traffic on dove road	traffic
do you like appreciate cats or dogs more	do_you_have_pets
is my daughter's birthday on my calendar	calendar
when is my at&t bill due	bill_due
how do i update my pin number for my account	pin_change
i want to put in a pto request for march 1-8	pto_request
any idea where flight dl123 is right now	flight_status
can anyone help me pay my car bill	pay_bill
i don't know how to spell squirrel	spelling
do you know where my cellphone is	find_phone
tell me what the gas mileage is on my car	mpg
my visa has been stolen by someone	report_lost_card
what is the caloric total in these muffins	calories
remind me to take the chicken out in a hour	reminder_update
what's the best way to get a mastercard	new_card
cancel my reservation at osteria for our party	cancel_reservation
can i obtain health benefits	insurance
what's the funniest thing you know about artificial intelligence	tell_joke
get me an uber	uber
where can i find when my car payment bill is due	bill_due
spell curiosity for me	spelling
would you tell me who made the ai	who_made_you
can i substitute rice milk for milk	ingredient_substitution
what is the status of my frontier flight	flight_status
is honey a good sugar substitute	ingredient_substitution
what ingredients are in beef jerkey	ingredients_list
can i have more information about this car's highway mpg	mpg
is it okay to switch water for milk	ingredient_substitution
roll a 9 sided dice	roll_dice
pair with phone	sync_device
"""where i can use word """"rescind"""	definition
who's responsible for your existence	who_made_you
tell me some things i can do to secure my credit rating	improve_credit_score
how should i address you	what_is_your_name
should i schedule a car maintenance	schedule_maintenance
something's come up so i need to cancel my reservation so now	cancel_reservation
what's an example of a good apr and what do i have	apr
i need to rent an suv in charlestown for the first week in june who do you suggest	car_rental
you need to help me find my cellphone	find_phone
is there any traffic on the way to the bank	traffic
what's the name of this song i'm listening to	what_song
where were you programmed	who_made_you
i need to know how long until the next day off	next_holiday
please remind me to do this later	reminder_update
is my tire pressure okay	tire_pressure
when does my flight arrive	flight_status
when will my next vacation day be	next_holiday
