text	label
where is the closest red lobster to my location right now, which is 5th avenue	directions
can you tell me what time i am meeting with sarah today	meeting_schedule
you could tell me if you were real	are_you_a_bot
find me a hotel with good reviews in phoenix	book_hotel
delete all calendar entries on march 3	calendar_update
what subjects or areas are you familiar with	what_can_i_ask_you
at four, how much business does georgio have	how_busy
i'd really like to set up a direct deposit for my paycheck	direct_deposit
could you schedule a meeting with john smith at 1 pm tomorrow	schedule_meeting
where is the closest gas station to glendale	directions
give me a hand finding my mobile device	find_phone
recipes for garlic bread please	recipe
disconnect from my phone	sync_device
what's the weather looking like	weather
x is who i need to call	make_call
i need to know all about the nutrition of the beef taco	nutrition_info
when would you change my tires	tire_change
what is the mpg like for this car while driving in the city	mpg
was my order dropped off	order_status
i need a 10 minute timer	timer
how long do i have left to pay for my chase credit card	bill_due
go back to initial settings	reset_settings
when do i finally get a day off	next_holiday
tell me something funny about horses	tell_joke
i was in target about to buy a chair when my card got declined	card_declined
let me know how to make a vacation request	pto_request
if you were getting a pet, would you get a cat or would you get a dog	do_you_have_pets
my credit score is	credit_score
please remove the phone's sync	sync_device
what things are on my todo list	todo_list
i need you to reset your factory settings	reset_settings
i want to learn a neat fact about black holes	fun_fact
how many canadian dollars can i exchange for 200 yen	exchange_rate
where's my w-2	w2
show me the application for a visa card	new_card
show me what's on the shopping list	shopping_list
is it going to rain tomorrow	weather
can you check when my visa card expires	expiration_date
do you enjoy any hobbies	what_are_your_hobbies
what are my insurance amenities	insurance
i want to visit chicago by bus what do i need to do	directions
what hobbies do you enjoy in your free time	what_are_your_hobbies
is there a way to get a new insurance plan	insurance_change
water is spelled how	spelling
when do i have to get my tires changed	tire_change
how much total gas do i have	gas
how is the traffic on rt 5 towards my work , community bank	traffic
how much vacation have i taken	pto_used
can you show me my shopping list	shopping_list
how much are taxes on this	taxes
can you call an uber for 2 to go to proof on main	uber
please only call me joe	change_user_name
are there any holidays coming and when	next_holiday
i really cannot remember what my pin is for my bank of america checking account	pin_change
put on lights	smart_home
do i need a visa to travel to mexico	international_visa
what do you do in your spare time	what_are_your_hobbies
tell me what is on my calendar for march 2	calendar
what is the meaning of incandescent	definition
create a new timer	timer
when can i commute my tires next	tire_change
when's payday	payday
i need you to make my bank aware that i will be visiting taiwan from the 22nd of february until the 3rd of march	travel_notification
i'm out of soap so will you order me some more	order
what is your name	what_is_your_name
what do i have on my calendar for march 2	calendar
can you cancel it	cancel
please set a reminder for me to put the clothes in the dryer	reminder_update
for how long have you existed	how_old_are_you
can you change the limit on my credit please	credit_limit_change
ai, what do people call you	what_is_your_name
i was at macys trying to buy shoes and my card got declined	card_declined
reserve a meeting room for friday, 5pm	schedule_meeting
i must get a hotel in phoenix near chase field from january 4th to the 8th	book_hotel
show me trivia about cats	fun_fact
how do i know that you're a person	are_you_a_bot
can i put in a pto request for september 1st to september 8th	pto_request
if i lose my job will my credit score go down	improve_credit_score
has my credit card application been processed yet	application_status
i think it is false	no
what's the date on which my last oil change occurred	last_maintenance
i'm out of paper plates so will you order me some more	order
i'd like to buy a lamp online	order
what are the pets that you raise	do_you_have_pets
help me get an american express card	new_card
i need to do cleaning so add it to my to do list	todo_list_update
is there meaning in life	meaning_of_life
i'd like to know when my next day off is	next_holiday
the reservation i created is not necessary anymore	cancel_reservation
schedule an uber to the bean	uber
be quiet	cancel
what's the current amount of vacation owed to me	pto_balance
what kind of reviews does the olive garden have	restaurant_reviews
i don't need my reservation, can you cancel it	cancel_reservation
i am going out of country and my bank needs to be notified	travel_notification
what was the reason my bank account was frozen	account_blocked
timer 5 minutes	timer
is there anything fun to do in berlin	travel_suggestion
i want to reserve table for 5 at red robin under the name sara at 5	restaurant_reservation
set my temp to 75	smart_home
instead of pepper, can i use salt	ingredient_substitution
does my checking account have a pin number	pin_change
when's my next payday	payday
what can i ask you	what_can_i_ask_you
i need to know how many carry ons i can take on a flight with southwest airlines to houston	carry_on
where my phone	find_phone
online order: status	order_status
put a block on my amalgamated bank account right now	freeze_account
how does this cars mpg do on the highway	mpg
please introduce yourself	what_is_your_name
i'd like to cancel my reservation for 5 at hoss's steak house	cancel_reservation
could you submit a pto request for me for dates june 11 to 14	pto_request
hit me with a good joke	tell_joke
can you submit a pto request for me from dates nov 2 to 10, please	pto_request
when am i due for my next paycheck	payday
who can look at my car, the engine light is on	schedule_maintenance
what is the spelling of potato	spelling
what's my vacation day usage so far	pto_used
freeze my account at the bank immediately	freeze_account
tell me if you are a person or ai	are_you_a_bot
how do you address me	user_name
when do i need to pay my dte energy bill	bill_due
can you please talk slower	change_speed
you can call me michael	change_user_name
can i swap chili for sloppy joe mix in the recipe	ingredient_substitution
please suggest meals from italy to me	meal_suggestion
provide a random roll of the dice	roll_dice
how many holiday days do i have left to use	pto_balance
do you know any fun facts about mt everest	fun_fact
read me everything on my shopping list	shopping_list
make my pin 1234 for my checking account	pin_change
are the reviews for mi casita good	restaurant_reviews
on a flight with jin air to jeju, how many carry ons are allowed	carry_on
"""""""please contact my credit card company to report fraudulent activity on"""	report_fraud
how many pto days are in my possesion	pto_balance
can i get a new card	new_card
tell me how many days i've taken off at this point	pto_used
how will i find my current location	current_location
i want to find out what my credit score is	credit_score
i have a fraudulent transaction from fry's on my account	report_fraud
i need to add iep meeting to my calendar on april 15th	calendar_update
what is the real meaning of life	meaning_of_life
did i schedule any meetings for today	meeting_schedule
i need you to increase your speaker volume	change_volume
clear my calendar for tomorrow	calendar_update
put song in springtime playlist	update_playlist
if i want to travel to singapore do i need a visa	international_visa
i need to book a flight on jet blue to boston from new york	book_flight
is the gang getting together this afternoon	meeting_schedule
i need to let my bank know i will be in america from april to may	travel_notification
do you know when i can expect my next paycheck	payday
how do you spell out wednesday	spelling
what's the ultimate day for me to pay the internet bill	bill_due
what should i do for fun in tokyo	travel_suggestion
add bread to my list of things to buy	shopping_list_update
what is the current tune	what_song
i want to hear cool bee facts	fun_fact
set up a reminder to mail a check tommorow	reminder_update
give me the apr for my mastercard	apr
tell me what the word die means	definition
i need this song on my jam playlist	update_playlist
tell me the expiration date for my current credit card	expiration_date
does mexico require me to have a visa to travel there	international_visa
just shut up	cancel
show me popular sushi recipes	recipe
how do i put in for vacation	pto_request
i need to get my tired checked at one of the location	schedule_maintenance
does delta have any restrictions for what i can carry on	carry_on
i wanna play the song that goes like hey jude don't make it bad	play_music
when did i last collect my salary	payday
does international travel always require a visa	international_visa
refrain from talking	cancel
what sorts of hobbies do you enjoy	what_are_your_hobbies
take doing the dishes off my todo list	todo_list_update
i want to hear something funny about politicsi	tell_joke
go ahead and go back to the original settings	reset_settings
can you roll an eight sided die and tell me what it comes up as	roll_dice
track my package please	order_status
how much pressure are currently in my tires	tire_pressure
help me schedule a meeting	schedule_meeting
i need what ingredients for meatloaf	ingredients_list
what's today's high and low	weather
can i initiate a one-time transfer from my savings account to my money market account	transfer
can you find a hearty lasagna recipe	recipe
how do i get that tax form from my employer	w2
please take off my calendar on saturday the 6th birthday party for john	calendar_update
how do i inform my bank i'm going to paris	travel_notification
remind me to call my mother saturday morning	reminder_update
give me italian meal ideas	meal_suggestion
i need to know how to spell excellent	spelling
what is the name you call me saved as	user_name
how long should i cook a spiral ham	cook_time
i want to roll a dice	roll_dice
what is the best rated hotel in evans	book_hotel
to which company is your design accredited to	who_made_you
does france have any travel alerts i should be aware of	travel_alert
what did your friends call you	what_is_your_name
set a timer to go off in 5 minutes	timer
where can i pick up a good burger near where i am	restaurant_suggestion
what kind of plug converter is needed in c	plug_type
i accidentally bent my card, what do i do	damaged_card
what state were you born in	where_are_you_from
can you help me do math	calculator
what is the calorie content in potatoes	calories
what is my interest rate for my scotiabank account	interest_rate
please tell me the month and year of expiration for my discover card	expiration_date
please help me book a rental car for nashville	car_rental
how can i rent a car in las vegas	car_rental
what's my schedule like for thursday the 14th	calendar
are you familiar with any types of subjects	what_can_i_ask_you
i'd like to go on vacation	pto_request
what's the latest i can pay my cellular bill	bill_due
how bad is the traffic waiting for the staten island ferry at 8 am	traffic
i wish to apply for a visa card	new_card
i would like to request an uber please	uber
i would like to do some things in phoenix	travel_suggestion
i'd like to make a reservation at rooth chris, can you do that	restaurant_reservation
at yakamoto how is their sushi	restaurant_reviews
did discover get my card application yet	application_status
why is my bank account frozen	account_blocked
set default language to english	change_language
safety concerns for malaysia	travel_alert
can you call me bobby instead of bob	change_user_name
purchase a flight from boise to sacramento on sunday and returning on wednesday	book_flight
can you tell me what 30% off 279 is, please	calculator
what day is payday	payday
what is the definition of altruism	definition
i want to hear what you think life's purpose is about	meaning_of_life
how many years do you have	how_old_are_you
can i get to work on my fuel tank	gas
i'd like to report a fraudulent charge from people's natural gas	report_fraud
how do you set up direct deposit	direct_deposit
create a reminder to give the cat her flea medicine	reminder_update
where should i travel if i want to visit some history museums	travel_suggestion
when did my oil last get changed	last_maintenance
i creased my card today, contact the bank	damaged_card
i love dad jokes can you tell me one	tell_joke
where's the nearest gas station	directions
no that isn't the case	no
call dave	make_call
what's the nutritional info for an apple	nutrition_info
do they serve good tacos at the buffet	restaurant_reviews
hello, how are you	greeting
how are the reviews for tacos at the buffet	restaurant_reviews
give me my credit score	credit_score
how often should my tires be changed	tire_change
i must know the closest gas station to glendale	directions
is there anyone available to help pay an internet bill	pay_bill
i was trying to get food at publix, why was my card declined	card_declined
in cleveland, are there any good places that serve clams	restaurant_suggestion
where exactly am i	current_location
how many calories are in a cookie	calories
please remove laundry from my list of chores	todo_list_update
how much of my pto have i depleted	pto_used
remind me to call bob	reminder_update
get happy on my rb playlist	update_playlist
tell me if you can help pay a bill	pay_bill
let me know when my car was last looked at	last_maintenance
which holiday is next in line	next_holiday
do you have any restaurant recommendations	restaurant_suggestion
my card was not accepted for buying a computer at best buy	card_declined
what are the reviews like for bar tartine	restaurant_reviews
are there meetings scheduled for today	meeting_schedule
please raise volume	change_volume
can you play the song that starts with doo doo doo	play_music
i would like you to buy me some paper plates	order
create for me a pto request for march 16-21	pto_request
i would like to take a paid time off for february 7 and 8	pto_request
when does my gas bill need paid by	bill_due
give me the nutrition facts for chicken breast	nutrition_info
is pizza considered healthy	nutrition_info
what is 2 + 2	calculator
what is the due date for a bill	bill_due
has my card application successfully gone through	application_status
what’s my gas mileage	mpg
how much did i spend on furniture last week	spending_history
what's the balance of my savings	balance
what would i need if i wanted to make chicken marsala	ingredients_list
what's the interest rate on my savings	interest_rate
hey what's up	greeting
do you have any recommendations for korean	meal_suggestion
order more cat food, i'm out	order
how to i get to the mall on foot	directions
please get my car started before i go out to it	smart_home
how often should i change the tires on my car	tire_change
in one cookie, how many calories would i find	calories
what should i do if i need to report my card lost	report_lost_card
can you check who is at the door	smart_home
put we are the champions to my running playlist	update_playlist
what are the kinds of things you can help me with	what_can_i_ask_you
please assist me in linking my chase account to direct deposit for my paycheck	direct_deposit
do i have a car wash scheduled on my to do list	todo_list
please help me schedule a meeting with john love at 9 am tomorrow	schedule_meeting
what does my commute look like	traffic
please find someone who specializes in cars, my check engine light has turned on	schedule_maintenance
what's the current weather situation for tallahassee	weather
do you have any pet animals	do_you_have_pets
tell me when i received my most recent paycheck	payday
is it safe to go to serbia	travel_alert
what is the status of the application for a credit card i put in	application_status
how should i spell malignant	spelling
is there enough money in my discover account for airplane tickets	balance
the new name that i want you to call me is this one	change_user_name
add walk by pantera to my playlist	update_playlist
what length of time is safe for consuming leftover meatloaf stored in the fridge	food_last
where's my phone	find_phone
what places in chicago will allow me to rent a car from monday to friday	car_rental
tell me the amount of gas i have	gas
could you find my interest rate for me	interest_rate
speak to me in dutch	change_language
that is not the case	no
what place do you call home	where_are_you_from
pay a bill!	pay_bill
i want you to call me sheldon	change_user_name
what is the exchange to yen if i have 100 us dollars	exchange_rate
erase my to do list	todo_list_update
decrease your decibel level	change_volume
what location did you originate at	where_are_you_from
how's the weather in tallahassee	weather
what are you called	what_is_your_name
can you slow your speaking down	change_speed
roll a pair of dice	roll_dice
please set a 4 minute timer	timer
traffic looking alright going towards burger king	traffic
tell me how many days off you see that i have taken so far this year please	pto_used
i'm travelling to ireland soon and want to inform my bank	travel_notification
hello, i need to cancel tonight's reservation for dinner	cancel_reservation
read me my shopping list please	shopping_list
can you lock all the doors in the house	smart_home
book a flight from miami, fl to columbus, ga on 16 february 2019 and returning on 2 march 2019	book_flight
tell me about this cars fuel economy	mpg
how is friend spelled	spelling
tell me the mpg of this car	mpg
i would like to have my credit increased to 5000 dollars	credit_limit_change
can you teach me how to make sushi	recipe
see how many days i've taken off so far	pto_used
get rid of my dinner reservation	cancel_reservation
are any meeting rooms open between 9 and 10	schedule_meeting
can you give me a reading of my car's tire pressure please	tire_pressure
you are talking far too fast for me, can you slow it down a bit	change_speed
costa mesa weather	weather
what does zesty mean	definition
i need a stop placed on my bank account please	freeze_account
how is my ai doing	greeting
how much gas do i have in the tank	gas
can you play the beatles	play_music
i need to know how much i should pay in tax	taxes
where is my gas tank located	gas
contact the bank about fraud activity on my card	report_fraud
what kind of electrical outlet does that country use	plug_type
trivia about something,tell me some	fun_fact
i am requesting pto for march 2 and 3	pto_request
who do i report card theft to	report_lost_card
how many miles per gallon does it get on the highway	mpg
when was my last payday	payday
i want my schedule for march 2	calendar
are there any open meeting rooms between noon and 1	schedule_meeting
help find my phone	find_phone
find me a place to stay in cali november 11 to 15	book_hotel
what is the amount of gas i have	gas
what are the pets that you take care of	do_you_have_pets
my insurance plan needs to be changed	insurance_change
please kindly inform my bank i'm going to be in canada from next week to two weeks after	travel_notification
i'd like to rent a limo in las vegas from may 01, 2019 to may 03, 2019	car_rental
do i need to have a socket converter in canada	plug_type
tell me the subject areas you are familiar with	what_can_i_ask_you
can you tell me life's meaning	meaning_of_life
what are some things i can do in portland	travel_suggestion
recommendations for good thai restaurants in las vegas	restaurant_suggestion
you need to skip this song and play the next one	next_song
show me what the weather is like	weather
i want to learn an interesting fact about cats	fun_fact
how much money do i have in my various bank accounts	balance
could you put a stop on my bank account	freeze_account
how to apply for platinum card	new_card
i need my todo list read	todo_list
are there 8pm tables available at texas roadhouse	restaurant_reservation
which health plan do i have, again	insurance
can you call robby	make_call
what time will i be able to board the plane	flight_status
does my shopping list have tomato written on it	shopping_list
please stop my account	freeze_account
transfer four and sixty seven dollars from bank of oklahoma checking to security bank account	transfer
can i increase the credit limit for my bank of the west card	credit_limit_change
find me a hotel in seattle with great reviews	book_hotel
when is it going to rain again	weather
you have pets of what kind	do_you_have_pets
how's the traffic looking if i headed to fred meyer	traffic
i want you to call me something else	change_user_name
add cherrios to the shopping list	shopping_list_update
how much time left to pay my bill	bill_due
what are some way s i can do to improe my credit score	improve_credit_score
please transfer $250 from checking to savings	transfer
what time is it exactly	time
would you describe yourself as a cat or dog person	do_you_have_pets
no is the answer	no
the ingredients in pizza are which ones	ingredients_list
list happy on my rb playlist	update_playlist
so i made a fraudulent transaction	report_fraud
do i have enough to cover new skis in my bank of america account	balance
i'm going out of the country and need to notify my bank	travel_notification
where is the nearest fry's	directions
i need to know why my credit card transaction was declined	card_declined
i am going to speak english now	change_language
what do you prefer being called	what_is_your_name
i need to apply for a new credit card that will match my needs	new_card
can you tell me the amount of gas i have remaining	gas
i want you to go back to factory settings	reset_settings
what are the reviews like for mission chinese	restaurant_reviews
i want you to set a meeting with john at 5 pm	schedule_meeting
can we move onto the next song	next_song
how long can i have pizza in the fridge	food_last
can you add 5 and 89	calculator
get me an uber to the airport	uber
current weather	weather
who gave you life	who_made_you
can you spell out the word special for me	spelling
my card is wrecked, let's report it	damaged_card
what does 2 + 2 equal	calculator
how many dollars have i spent on coffee this month	spending_history
hey ai cancel it now	cancel
i'm out of cleaning supplies, remind me on my list	shopping_list_update
i want a new pin for my savings account	pin_change
alter your language choice to dutch	change_language
what is the status of my online order	order_status
i need a place in pittsburgh to stay from monday to friday, can you help	book_hotel
tell me the ingredients in pizza	ingredients_list
what's my current location	current_location
repeat that please	repeat
what is the expiration date of my credit card	expiration_date
i can't locate my mastercard and i want to report it as lost, please	report_lost_card
look up the lowest amount i can pay on my electricity bill	min_payment
am i speaking with ai or a real, live person	are_you_a_bot
what company designed this	who_made_you
who brought you into existence	who_made_you
i want a timer set	timer
what do my health benefits consist of	insurance
say what you think my name is	user_name
calorie count of cheetos	calories
find me the exchange rate between usd and cad	exchange_rate
can i get good tacos anywhere in austin	restaurant_suggestion
i would like an uber please	uber
i was at trader joe's trying to buy groceries and my card got declined	card_declined
can you get uber for two people going to 27 moss lane	uber
do you know why my bank account is frozen	account_blocked
book me a hotel in jacksonville near the stadium from january 1st to 3rd	book_hotel
can i get a higher limit on my american express card	credit_limit_change
move 57 dollars from saving into mom	transfer
hello, may i get your name	what_is_your_name
your birth occurred where	where_are_you_from
tell me something funny	tell_joke
is there really a meaning of life	meaning_of_life
i need to know what i have on my shopping list	shopping_list
what keeps you busy in your free time	what_are_your_hobbies
what do you think i am called	user_name
my card isn't working because its destroyed	damaged_card
put me back on my factory settings	reset_settings
hi there	greeting
how much is one us dollar in british pounds	exchange_rate
i really need to switch to a new insurance plan	insurance_change
secure the doors	smart_home
what is life's meaning	meaning_of_life
is there anything available in new york city from april 2 through april 8	book_hotel
have they looked over my app for the new credit card yet	application_status
please tell me my location using gps	current_location
are there any good chinese restaurants open right now	restaurant_suggestion
i need an italian dinner idea	meal_suggestion
tell me what the point of life is	meaning_of_life
add milk to my shopping list	shopping_list_update
i'm out of milk so you will order me some more	order
how do i update my pin number for my account, please	pin_change
should i purchase a new plug converter when in france	plug_type
i did not understand say it again	repeat
i shall know how low are my tires on air	tire_pressure
i need you to call the phone company for me	make_call
send money from one account to another	transfer
