text	label
Card payment is still pending, why is that the case?	pending_card_payment
I lost my card. Can you help me?	lost_or_stolen_card
is there a way i can see source of money?	verify_source_of_funds
How would my friend be able to send me money?	receiving_money
The app reverted my recent payment	reverted_card_payment?
Do you allow exchanges of EUR?	fiat_currency_support
Any place that takes Mastercard would be fine.	card_acceptance
can I have multiple currencies?	fiat_currency_support
I tried to get money out of the Notting Hill ATM earlier, but I wasn't able to get it to work. Is my card with issue? It's the first time I tried using it.	declined_cash_withdrawal
I see a reverted payment on my account. Why has this happened?	reverted_card_payment?
Can I change my pin number at a cash machine?	change_pin
What foreign exchange rate will I get on weekdays and on the weekends?	exchange_rate
Top-up is not working	top_up_failed
Why am I unable to transfer money when I was able to before?	beneficiary_not_allowed
I have to verify my source of funds.	verify_source_of_funds
How can I tell if my top-up has been cancelled?	top_up_reverted
I got charged twice	transaction_charged_twice
I recently transferred money to my account when will it show up?	balance_not_updated_after_bank_transfer
My salary comes in GBP can I change my options somewhere?	receiving_money
I got a message that I cannot name X as a beneficiary.	beneficiary_not_allowed
Does auto top-up have a limit?	automatic_top_up
Im not sure why Im being charged an extra fee just for purchasing an item from another country? I paid for the item and the shipping why am I getting charged extra?	transfer_fee_charged
I requested money from the ATM and it didn't give me as much as I requested.	wrong_amount_of_cash_received
I think my card is stolen!	lost_or_stolen_card
I am having trouble withdrawing cash.	declined_cash_withdrawal
It appears my top-up has not gone through.	pending_top_up
how many uses are the disposable cards good for?	disposable_card_limits
I left my phone somewhere and can't use the app.	lost_or_stolen_phone
I would like to top up my account with a bank transfer, is that allowed?	transfer_into_account
What are the steps for identity checks?	verify_my_identity
I am wanting to refill my card, is there a charge?	top_up_by_card_charge
I'd like to delete my account.	terminate_account
How long until transfers complete?	pending_transfer
Could I open an account for children?	age_limit
How do I activate my card to start using it?	activate_my_card
Tell me how a top up would be reverted.	top_up_reverted
Can I get another card?	getting_spare_card
Is it possible to delete the account?	terminate_account
Someone may have made an error in figuring out the rate of exchange.  I should have received more cash than I did on my most recent withdrawal.	wrong_exchange_rate_for_cash_withdrawal
i've waited 2 days for a transfer to reach a retailers account, am i going to have to wait longer.	transfer_not_received_by_recipient
My card hasn't been working for even small transactions today.	card_not_working
I got some cash but it wasn't the right amount.	wrong_amount_of_cash_received
My card is not working when I try to use it.	card_not_working
Why isn't my id verified?	unable_to_verify_identity
"""I made a transfer and according to the receiver """"they haven't received the right amount"""" Its lesser than it should be.Now I have to transfer more money to make up for the missing amount . Can you please help me about this, what should be done ?"""	transfer_fee_charged
Could you assist me in finding my lost card?	lost_or_stolen_card
When shipped to the US how long is delivery time?	card_delivery_estimate
I would like to track the card you sent to me.	card_arrival
the exchange rate at which my card payment is at is wrong	card_payment_wrong_exchange_rate
I made a bank transfer and the balance hasn't updated yet.	balance_not_updated_after_bank_transfer
I could not get money from an ATM	declined_cash_withdrawal
A transfer has to be cancelled.	cancel_transfer
I believe my top up has failed	top_up_failed
I did a bank transfer and my balance isn't current.	balance_not_updated_after_bank_transfer
How long does it take to activate the card, as it does not look like its working?	activate_my_card
When will my account receive the money?	transfer_timing
Why does it show that my transfer is still pending?	pending_transfer
Top up not available in my wallet.	topping_up_by_card
Is there any type of fee for currency exchange?	exchange_charge
My card payment is showing up as pending for a very long time, what's going on with that, it should be going through at some point?	pending_card_payment
I want to get a Visa and Mastercard, is it possible to get both from you?	visa_or_mastercard
I forgot my passcode. Now what?	passcode_forgotten
Are their fee's for top ups?	top_up_by_card_charge
Is it possible for a friend to personally send me a payment?	receiving_money
Is there a way to use a cheque to top up my account?	top_up_by_cash_or_cheque
I can't see a transfer to my account I made.	balance_not_updated_after_bank_transfer
When I purchased a product in another country the currency exchange was incorrect.	card_payment_wrong_exchange_rate
I paid with my card and was charged extra	card_payment_fee_charged
Why would I get a decline message in a transfer?	declined_transfer
My PIN has been blocked.	pin_blocked
i put in money for vacation and its not showing. i need that money today, how long will it take	pending_transfer
I enetered the wrong information, I need my account unblocked How do I do that?	pin_blocked
I made a card payment which is showing me pending.	pending_card_payment
I going to be traveling, can I set up auto top-up if I run low on money?	automatic_top_up
I'd like to open an account for my children. How can I do that?	age_limit
What's going on? My card wont accept any transactions.	card_not_working
There is a payment that I made that hasn't gone through yet.	pending_card_payment
